<?xml version="1.0" encoding="UTF-8" standalone="yes"?>
<libreria xmlns:xsi="http://www.w3.org/2001/XMLSchema-instance"
    xsi:noNamespaceSchemaLocation="libreria.xsd">
    <libro>
        <titulo>El Quijote</titulo>
        <autor>Miguel de Cervantes</autor>
        <editorial>Editorial Cervantes</editorial>
        <precio>20.00</precio> 
    </libro>
    <libro>
        <titulo>El Señor de los Anillos</titulo>
        <autor>J.R.R. Tolkien</autor>
        <editorial>Editorial Tolkien</editorial>
        <precio>25.00</precio>
    </libro>
</libreria>